camry本来就是同级车得标竿，在这级距本来他的对手就只有他自己，说哪台车好哪台车不好，说实在的~~只有销售数字不会骗人产品好没道理卖不出去，东西卖不出去不去找原因反而在这边取笑别人，我是觉的很可怜啦~~accord跟ecoboost为何不75万起跳，回馈消费者也好阿，有人买才有机会淘汰大家口中烂产品，不愿在价格上做让步，只想请些人在网络上打嘴炮~~怪不得东西卖不出去	3.25	6.666666667
请问altis10.5冷车启动转速2000rpm是否有问题新车时还不会第一次保养完有换自排油)就这样了问计师又说正常但公司里5台altis都没我这样高开我朋友的冷车发动也才一千多引擎安静不吵杂不像我的非常的大声杂音很多我在想是不是常常高转速热车有伤到一点ps机油使用5w50原厂油发车必热车不开快车10.9两千转维持几秒钟而已后面会慢慢的掉回一千出头我的疑问是为何朋友的车不会这样而我的会是否有办法调整	3.428571429	5.428571429
如果坦克真的那么便宜又那么好，为何多数人都不敢用。	4.875	4.333333333
呵..老实说一堆开着t牌的，说要用好轮胎比较重要，结果还是爆烂轮胎..不然就是一台便宜的车，改的乱七八糟排气声又大...不重视安全性的乱钻结果跑起来比人家富豪..s60没改的车还慢我相信消费者都是明眼的只有些业务和网军是喇叭嘴的所以那些家伙我想大概塑化剂当水喝..因为对他们来说..没差.....所以.	3.222222222	5.8
塑化剂喝多了结果是..相信大家都知道没关系，没关系技术补足一切	3.25	5.75
今天下午去朋友车厂突然看到一台车跑来仔细一看这不是准备要国产化的camry嘛!而且还是hybird版赶快跑去对面拍几张照片至于车里面的人不知跑去哪了呵呵...看到有人说原来是旧款的camry难怪觉得怪怪的无所谓啰!反正本来就没再注意toyota的车认不出来是正常的啰!所以大家就看看照片就好了	4.777777778	4.0
谁友善，谁不友善大家都看得很清楚每次讲到油电总是会有很奇怪的批评priusc没开过不过个人经验会觉得油电车力量不够	3.125	5.875
说真的买到最便宜的我真的会很开心，买到很贵的会呕个老半天可能是我比较不同吧!!我买东西都希望买到便宜的，不想买贵被当盘子敲耶~回想起来，家中从以前到现在已经买入1x台车子，只要交完车付完钱后，再也不见业代踪影..屡试不爽喔!几乎各大汽车品牌都有过经验，所以从此再也不相信业代口中的服务价格便宜给我，对我来说才是最好的服务~~	5.333333333	5.222222222
以数落丰田的不足来突显你开福斯的优越只会搞臭福斯车主的名声拥有如此极端偏颇的观念没有资格驾驶福斯批评丰田车主格局小自己却是自我感觉良好的井底之蛙不尊重丰田车主你也该自爱保障一下福斯车主的尊严吧补充说明你朋友照品牌车主雇人的方式绝对做不久因为比丰田车主更没格局	2.75	6.285714286
我原本前一台车也是小鸭，你所描述的状况我都知道，也经历过	5.0	4.0
我也从没买过toyota的车不是toyota不好纯粹是预算刚好不在那个阶层;除了老婆曾在加拿大买了一台yaris;但我从不认为别人买toyota就是不懂车或啥的青菜萝波各有所好如果你的车被说成是垃圾/会撞死人的车.	3.666666667	6.375
你会很开心吗?	5.25	5.75
换个角度看有些冷门车的车主自以为很有品味很懂车那些人的车在别人眼里可能比toyota更像垃圾	3.25	6.25
大部份人用车多是在市区走走软悬吊适合台湾烂路。	3.375	4.428571429
丰田车子很大众化符合最多人的选择但缺乏个性化不过台湾人很爱跟风潮的这在台湾变成不是缺点第三点很忠肯欧系车遇到烂路真的会抖出一大碗	3.222222222	4.75
我猜应该60-95km/h以下我开小v快二年了当初是因为想省点油钱...小v在100km/h大概2800-2900转左右110km/h大概3000转起步大约3000转就会换档拉回了市区一般行驶时大概都在2000转上下建议不要跑太快耗油加上不安全....尤其下雨天高速公路有积水的话超刺激100km/h过小水波区会瞬间空转降速到快90km/h说另外个人平均油耗冬天不开冷气)13.5-14左右夏天开冷气12.5-13左右结论是台外型还不错的省油小车优点)隔音差到爆是我觉得最讨厌的缺点)	3.444444444	4.857142857
你可能会得到新人奖其实你说的没错不过这必须运用到你的智慧与眼光做出你的风格应该会有收入我有认识2种业务一样100俱乐部一个能折就折连年终都折下去苦哈哈一个一台车都有办法留2w笑哈哈2w那个长的很老实说话稳有内容不单只是卖车是假专业汽车顾问这是他的本钱不过事实它是个很会包装的人~我发现上面有人说讯息月历电话送礼蛮会谈判还能留钱)不做徒劳无功事情ps不会买的客人)祝大家民国100迈向100	5.0	4.142857143
整天想护卫队也不知道是无聊然后幻想的还是怎样?	3.625	4.888888889
请看清楚我的回文好吗？动不动就骂人我是请部份说camry很不安全的朋友提出比较明确的证据这样子也会被您说强迫症您是精神科的医师吗？楼上有位朋友批评我不一定懂相机我查了一下这位仁兄在摄影版的发言要是我像这位仁兄一样讨论类似的主题我一定不敢说谁懂或谁不懂因为还没到那样的level啦一位现任camry车主留	3.444444444	6.777777778
其实就楼主描述及照片看起来，也不能全怪是神车不好!弯道中时速70已经不慢!再加上是爆后轮，肯定会有甩尾的现象!再加上路面质量不好的时候，翻车应是不意外，每个人对车子的敏感度不一，反应度也不一!照当时情况能救回来的!应该是经验老到，有不错反应能力的人!.....总之人安全就好，车再买就有!去收个惊，改改运好了!	4.888888889	5.875
有esp一定可以增加失控后的恢复，或是阻止失控，至于能恢复多少要看当时的环境但没有esp，就是看自己的运气了好笑的是，有失控经验并存活下来的人的人不见得能体认到车子需要esp这类系统这种人就是我老婆，上次他们家老可在高速公路上打转转，天气晴朗	4.857142857	3.714285714
国外之前就作过测试了找一堆自认为反应一流、技术不错的一般驾驶人来开结果espoff的情况就是打滑失控.....espon则好很多我发现01版上神人很多，老是呛别人不会开车自己最会开我在想这究竟是自我感觉良好或是自我安慰?	3.333333333	5.75
买toyota就好像娶老婆便宜不用太多聘金就可以入手外型又很好看只是没有精品名牌lv加持平常都不会闹脾气5000公里花一点小钱他就爽了不用常常花各4千弄头发一万买保养品3万买lv10万买钻戒的使用它的时候舒服就好了不需要太多的技巧能达到目的地就好了不需要一直大马力冲刺重点是等你想换掉他一堆人愿意出高价去接收咧一般的男人甚至女人需要的不就是这种车当然想要的都是林志玲名模等级的那种欧洲车跑车	4.875	5.142857143
说真的新旧引擎又如何看上眼的还是一堆你跟他讲新旧引擎的差异可能也只会回答差不多啦能开就好但是你跟他说这个新的走dvd莹幕+卫星导航啥咪5.1环绕音效不用加钱一堆阿萨布鲁的配备这套对很多人都是一大吸引力毕竟引擎看不到dvd可以在车上爽这就是车商把台湾人的胃口养大了没有6个安全气囊没关系就是不能没有dvd屏幕没有abstcsvsd一堆电子配备也没关系反正开出去自爽就好	3.666666667	5.444444444
当然..你可以正名但也请不要一竿子打翻一艘船会选toyota的人并不是无知或是没做功课只不过每个人需求不同罢了其他车厂有toyota所没有的优点有更好的超控，底盘，动力，安全但是toyota也是有他所有而其他厂比不上的优点所以请不要说选toyota的人就是没做功课谁买国产车是像选衣服一样随便买的?	3.25	5.888888889
说白了只是各取最适合自己的车罢了我这样也算正名吗?	4.111111111	4.888888889
有钱归有钱...可是我实在不懂有钱然后拿camry来这样玩有什么意义?	3.444444444	5.857142857
有钱为什么要买camry?	4.444444444	5.571428571
平常热血的我看到跑车玩drift或powerslide偶尔也会觉得挖~好酷!!..我也要努力赚钱!!可是这次看完影片我个人只觉得........	4.333333333	4.888888889
有更多的车子更好玩为什么都是这种中大型经济房车?	4.666666667	4.571428571
保养买车容易养车难...骑机车很方便油钱保养都便宜停车也不用收钱只是辛苦了点下雨天麻烦天气太冷或天气太热都不方便那又怎样反正只是上下班而已忍耐一下噜!干嘛为了那一点爽度而去浪费辛苦赚来的钱呢!!!体谅老婆是好男人的行为!!!但是请量力而为吧!	4.875	5.142857143
不一定，看内铁或欲装内铁处)后的车架结构，没比内铁强冲击就传过内铁伤车架，反之就由内铁吃下冲击这就跟轿旅或suv前后白铁硬质保秆外挂别乱装是一样意思，原先好好的塑质保杆.	4.875	5.0
发泡体吃的下的冲击非得直接让硬质白铁保杆传去给车架硬吃伤到车架这样装外挂就没意义了，所以一切都看原始设计...	4.555555556	4.75
恰巧刚入手ct不久...首先，我觉得油电车不好开，但好玩！	6.0	5.666666667
别有一番驾驶乐趣。	6.0	5.111111111
如果要off-road，该担心的不只是动力来源了至于环不环保、省不省钱？抱歉，我几乎没考虑过这些问题！	4.111111111	5.875
小弟今年农历年前刚牵的rav4最近两周早上发车后开冷气时会闻到很重的异味味道酸酸的非常难闻前两天送回原厂检查技师居然跟我牵拖东牵拖西的还说这是正常的这两天我将内部整理干净后再测试发现到单纯送风时的异味感还是很重不过开了a/c后有好转请问大家有何建议新车就如何那以后还得了我希望能有好方法来让原厂重视我的问题	4.0	5.0
我也觉得有esp固然很好，但绝对不是万能一台车失控，若没esp，乡民就说，因没esp	4.5	3.75
好吧讲其中一个理由我认为一台1.6吨的车子油耗只有14km/l	4.625	5.142857143
请恕小弟无知问一个疑惑已久的问题...既然gtr那么厉害，为何中里毅会轻易的被帝王队的板凳球员清次打败?	4.111111111	5.666666667
京一才是帝王队的王牌，都不用他出场了，我看不出中里毅是因为技不如人才输了那场，看起来像是车子性能远不如对手...意思是evo4比gtrr32强?	5.0	5.875
就算质疑中里的技术，神之脚在下坡也彻底输给了启介，神之脚的技术没人质疑吧?	4.714285714	5.0
唉往事不堪回首何必再提我就是那位幸运的civic车主啦不过就是有没有后保险杆内铁的差别罢了没必要扯到品牌耐撞与否的问题civic是台跨时代的好车altis的好	3.777777778	5.375
事后我已经去装原厂后内铁了拍卖店家有进honda原厂后内铁装到好大约10张小朋友有找)altis放马过来吧当然是说说而已..希望所有车主小心开车~安全第一啦!)我在vtecspirit的id跟这里的一样啦~请多多指教)	5.333333333	4.0
每天发类似的抱怨...不累吗?	3.333333333	5.125
假如他不安全，买你觉得安全的车啊!假如开起来不像跑车...那就去买跑车啊!!配备不够，没有足够的安全气囊。	3.25	5.625
藉此分享一下人人喊打的铅酸电池情况一般人对车用铅酸电池直觉就是高污染的毒物铅本身的确毒性很高但是回收容易又有利可图无须任何补助回收铅本身就有利润只要收回厂的防污设备做好就行以美国来说车用铅酸电池回收率达到99%老化铅酸电池一般状况下也不会被弃置拿去家里附近的电池行都可以收个150-300台币间视铅价而定铅酸电池的回收循环中只要管制好非法黑心不装设防污设备的回收业者污染事实上很小	4.666666667	5.142857143
我开什么车不重要，但重点是绝对比国产的camry安全相对比较下camry对我来说不安全)还有作啥工作跟车子有啥关系?	4.333333333	5.625
殊不知路边伸手乞讨的，有可能是开大奔驰呢...至于反驳您的论点，也是您提出的论点实在过于荒缪路上常见到的车，只不过是符合大多数人购车的需求省油，妥善率高，并非啥安全性非常好的车款尤其是偷过安全配备的车款，而小弟的目前的所开的烂车，等级也只比国产的camry再高一点而已不是多好的车子所以就不拿出来说嘴了	3.375	6.0
你就像是秃头男，骂头发多人的发型很丑一样自己的车明明就是不到十万的破烂喜美不仅没vsc也没6气囊甚至连bas。ebd甚至又是十多年前喜美的烂车体没头发的人却骂有头发的人发型很丑真是好笑!劝你开过三台以上的车每一台都开过半年以上再来发表高论学生不要整天打在线游戏，又跑来汽车版装专家，会被人看破手脚的	4.0	6.444444444
不扯太远现在长辈还是认为国产车买toyota手机门号用中华电信光这2样就有够糟糕不是t牌不好而是代理商的心态很糟糕反正买t牌的不会开快车然后台湾的国惨车基本上配备都是不够的电信公司更....网络还是不对称的adsl速度更...但是长辈们还是这么认为不过等我们这些青少年变成所谓的老一辈的时候我不相信还能再赚到我们的钱	3.375	4.428571429
偷很多不是只有这部就开始了，但是还是很多人买，甚至更多人讨论t牌的安全性不足的问题，不过买的人就是多，你放心！	4.75	5.75
真的!!不怕死的就买toyota;安全配备极差，开船上路还乱开的不少，要小心被撞~怕死的就买focus;版金好	3.5	5.333333333
之前在汽车百货看到这只司柏奈)德国油在台分装在特价188，想说俗俗买来用用看~起步轻快引擎声变小但太黏尾速缩掉了还有清洁性不佳听朋友介绍下~用了力豹仕~真的好用~拉转力道猛爆~可惜油耗差了些跟其它牌10w40的机油比)后来看到仓库卖的agip5w40~忍不住又想买来玩玩看~还蛮省油的~仓库卖的比汽车百货便宜好多~好卖家^^这几只油是我用过还不错的~贴上来让大家看一下	6.75	5.625
个人认为会买toyota的客户大都不会做买车前的安全比较，有可能是老一辈口耳相传或厝边朋友的意见。	4.777777778	3.875
但质量，品牌或省油的优势是不是真的一直维持，2.5的销量很快就能反映出来，	5.5	5.625
如果因为2.5的税金还有一些优势不存，再加上很多安全配备被削减而导致销量骤减。	4.0	4.571428571
其实讨论就好，也别针锋相对...唉，说太多，等等我也会冠上护卫之名.	3.333333333	5.125
真的，主、被动再强，还是驾驶人的观念最重要，不然也不会有名人的高级车或超跑...等的撞车新闻了，虽然都没大碍，但开t牌的，撞车就一定会死人，是吗?	3.7	6.0
深感不以为然才发文的，另一方面某种程度上我也给了楼主一些建议，那就是toyota的车要操坏没那么容易没想到几天没上来看结果这整栋楼歪掉了，对此对楼主致上歉意，小弟真的没想到会如此楼主有问题上网寻求帮助和经验分享，请各位高手先进们回复到楼主的议题，并祝新年快乐，谢谢	6.25	3.4
如果不常跑高速公路，比方说小黄如果后做不常带小孩，或是只有偶尔载不熟的朋友那安全配备低一点无所谓，可以省很多钱台湾人命的值钱程度随着国力不振早就成长有限只能说，不同产品有锁定不同客层想要强调安全的，自然会去买其他车厂的或是进口车不然去买lexus啊....安全气囊或是esp都少不了的便宜就是有便宜的做法，有钱能买汽车，谁想要骑机车去肉包铁呢?	4.0	5.428571429
这你就错了!懂车的人注重车的人真的不会去开toyota这你慢慢去外面观察跟多交交有开车的朋友就知道了!!另外你说有些冷门车的车主自以为很有品味很懂车那些人的车在别人眼里可能比toyota更像垃圾你得这段话真得很可笑!还挺想听听看哪些是你认为冷门的垃圾车?	3.25	7.166666667
这种状况我最近也遇到，一位长辈在借开is250上武岭后，直接说买这种车真不值得，倒不如买camry还比较舒适，他介绍好几个朋友买camry，每个开过都赞不绝口	5.857142857	5.5
唉~又是一篇无聊的酸文！	3.222222222	5.5
自己的神主牌被说到缺点，就一定得如此酸吗？成熟点吧！	2.555555556	6.666666667
了解到它是一部主动安全缺乏的机器！	3.625	6.166666667
请注意且小心的操控它！	5.125	5.555555556
不要轻易的挑战它的极限！	4.5	5.571428571
安全~是唯一回家的路！	5.5	4.0
ok~了解吗？只是希望你认清事而己！	4.25	4.875
此道路为单线道但是道路上并不有话单向或是行驶路线路边无话黄色线道也无红色线在整个过程中对方撞到我之后变成静止状态以机车量的距离与宽度大约是1.5台车也就是说机车改4轮以人的话可以至少占4个人所以你说你们说我气愤不气愤重点是看他服务那么多年的环保局垃圾车既然会撞我车子会不会太夸张了再稍微些10~15角度转弯处太夸张了只能说只想回他几句脏话哈哈	3.222222222	6.875
我个人是换kyb黑筒避震器觉得比原厂还好多了而且又不会太软觉得可以接受，但我看网友都说toms不错也可以给版主参考我觉得每台车子都有优缺点改善缺点即可，至于版主提到何时更换我也有想过此问题，最后我认为越早越好，不要开了四年保固后才换避震器我个人觉得失去更换意义，给您参考~~	5.25	3.0
安全线已到--我见过开到钢丝外漏还不愿意换的车主卡车，这种人最可恶，没钱换胎开什么车，走路就好了，不要害人。	2.555555556	6.714285714
爆胎就是松油门松煞车，全心对付方向盘	4.888888889	5.0
如果是直线因该会比较好一点.	4.5	4.625
我在高速公路上看过一台箱型车爆胎，还可以平稳慢慢的开到路肩，真的很冷静.	5.25	4.5
前年是我老婆嫌她手边钱太多想换车见鬼了我穷得很她却有钱?	2.777777778	7.125
所以陪她去看这两年发现老福特tierra真的是比小孩喝汽水喝得快每周都在加油我不是出租车司机喔!所以决定要换车但跟女王的suv款拉锯上月初她才同意我买prius我太宠她太顺她结果她意见挺多所以奉劝未婚的朋友要man一点先以免跟我一样变成)偏偏碰上这尴尬的年份车款切换时期真无奈	4.0	4.0
小弟只是将龙卷风与之前讨论沸沸扬扬的事件提出来而已，并没有批判任何车.	4.75	4.5
烟灰...等等)你母亲就一定会要求将椅套拿去送洗在洗的期间，可以跟母亲说没椅套也蛮整体性	5.444444444	4.5
优点是地理位置不错，朝南的房间可以看富春江，可惜给我的所谓高级房是朝北的，怪不得人家说携程的客人比较受歧视。	3.333333333	4.625
首先非常感谢您选择东方大酒店，也非常感谢您给我们提出了宝贵的意见，酒店近期楼顶正在加层建造西餐厅	6.125	3.833333333
很舒服；服务不错，感觉楼层比前台服务更好；酒店周围环境真好，有山有海，本人在后山散步时差点掉下悬崖，建议酒店及时将后山半截路加上标志和围挡，太危险了！	3.571428571	5.444444444
夜间行走和小孩子玩耍更危险！	3.555555556	6.571428571
楼海景不够好，应该往上层更佳.	4.333333333	3.857142857
真是可笑，入住该酒店结账时要多付一袋开心果的费用，他们点不清自己的物品数量，出了差错，埋单的竟是消费者.	2.444444444	6.0
我选择坚决不再去.	4.2	5.714285714
如果要我给该酒店评分，我给它0分，他们的服务给客户的好感全被结账时愚蠢的举动所抹杀.	1.888888889	7.25
补充点评2008年4月15日：建议大家到日照时选择其他酒店，祝大家在日照开心.	6.0	3.833333333
酒店位置挺好，服务生态度很好，早餐很好。缺点房间居然不能上网，酒店工程师说是swtich坏掉了，从下午到晚上11点都没有修好，失望。	3.4	5.625
北京东方和平宾馆这家酒店给我感觉不好，虽然地段好，就靠王府井大街，但退房速度慢，房间隔音不好，有味道，看上去不干净。	3.0	6.0
不错，周围很热闹	6.25	5.555555556
但大堂办住宿的女士感觉不太适合服务行业。	3.444444444	4.0
最满意的是酒店提供的免费升标。	6.625	6.285714286
预定的是商务标间，由于客满，酒店给我们免费升到了高级商务标间。	7.0	5.428571429
要说不足之处，一个是前面有网友提到的隔音效果不太好。	3.5	5.444444444
"""1、地理位置闹中取静2、如果在五角场附近办事，交通还算方便缺点：1、房间内有浓重的烟味2、空调滴水刚好在楼下的玻璃钢瓦上，晚上比较吵3、洗澡水“小水无力”，感觉更像是“跑、冒、滴、漏”的水龙头3、早餐比较差既没有""""吃饱""""的实实惠惠，也没有""""吃好""""的丰富多彩)4、毛巾泛黄5、枕头很尴尬两个偏高、一个偏低)"""	3.6	4.625
您好，再次看到您的点评很开心，感谢您再次选择国宾大酒店入住.	6.5	5.625
酒店非常重视您提出的宝贵意见，酒店会针对卫生间地板滑的问题研究解决方案.	5.111111111	4.875
希望下次入住时您能感受到我们的改进!我们期待您的再次光临!祝心情舒畅	6.444444444	3.5
商务间，说是给携程的年终优惠，意外地满意。	7.0	6.375
感谢您对大连银帆宾馆的满意和支持！	6.6	5.333333333
商务间是比基础房型豪华间高两个级别的全新房型，目前推出年终回馈498元商务间升级活动，希望大家更喜欢我们的新房间、新银帆！	6.375	4.375
银帆宾馆欢迎您！	6.222222222	5.625
首先酒店任何员工对客人都没有应有的尊重，客人可以被他们呼来呵去，其次check-in和check-out都要半小时以上，强烈bs张灵芳和左瑞雪，效率低下，态度傲慢.	2.444444444	5.333333333
第五，酒店主要面向团队，不喜欢商务客人。第六，房间隔音极差	2.222222222	6.714285714
感到特别安全。	6.375	4.571428571
本人住的是主楼28204房，客房服务人员和前台小姐、门童的态度都十分好。	6.666666667	4.857142857
美中不足之处是早餐一般，有时客人没有吃完，早餐部的服务人员就自己坐下来吃了，需要改进。	2.857142857	4.857142857
实在是庭院深深，适合有车的朋友住。	5.5	5.222222222
地处繁华，服务员很友好。	7.3	5.125
感谢您选择入住西湖四季酒店。	6.375	4.25
对您此次入住的不愉快酒店深表歉意，若您对客房清理的时间有一定的要求，请拨打房间内座机上的一键通，前台会通知管家部及时给您的房间进行打扫。	5.444444444	3.428571429
感谢您的点评，并期待您的再次光临！	6.375	4.777777778
房间偏小，软件应该能达到三星级的水平，硬件稍差。	3.777777778	3.285714286
空调温控不好，暴热，呵呵。	2.777777778	5.111111111
地毯有点脏。	2.9	5.142857143
出门左转50米就是地铁站，东四十条上打个车也方便，地段不错。	6.555555556	4.571428571
房间很干净的，住的朝南的房间，太阳照进来很舒服，现在可以上网了，网速也不错的说。	6.888888889	5.555555556
月坛北街上的护国寺小吃我也老喜欢的。	6.0	4.571428571
缺点么，就是隔音不是很好。	4.0	4.428571429
一家4星级宾馆，设施方面实在是不敢恭维。	3.25	5.75
我住的是标间，可能其它房间会好一点。	4.5	4.5
但就这一点，我想我以后是不会去住了。	2.75	4.333333333
当然好的地方也是有的，自助餐还不错，内容比较丰富，味道也不错，特别是那个什么虾。	6.444444444	5.0
地理位置：正对长春火车站，优点：方便乘火车的朋友，缺点：感觉环境有点乱，物价较高，但周围各种饭店很多。	4.777777778	4.285714286
房间：大小一般，被褥比较干净，离马路有点远，晚上比较安静。	6.333333333	4.333333333
我们正对电梯，所以电梯停靠和人声比较嘈杂。	4.0	3.666666667
含双早，种类比较丰富。	5.444444444	2.0
是我在北戴河附近住过的的比较舒适的饭店，是凯莱管理的，从服务到设施都比较正规。	6.428571429	5.0
房间有点旧了，但还算整洁，水有点黄，建议多带点瓶装水饮用，环境不错。	6.0	3.0
服务也不错，效率很高。	6.888888889	6.285714286
小宝宝们准备了塑料的餐具，很周到。	6.625	4.25
位置还比较好找，交通、娱乐、购物都比较方便，服务一般化，进门都没人理，房间太小了，隔音很差，早餐品种太少又不好吃，弄脏了一块小毛巾又不是洗不掉就让我陪10块钱，房费已经预付了，结账时只需要退我押金就好了，结果等了将近半个小时，前台就一个人，对这个酒店很失望！	2.222222222	4.666666667
