「台北暗杀星」迎战「新加坡先锋」的前两场比赛都获得胜利，全场一片欢呼，当冠军奖杯将要落袋之际，怎知第三场被对手以精准选角取得优势，「台北暗杀星」受挫败阵。	3.375	5.0
金钱与击杀数都难分轩轾，直到一次会战中，「台北暗杀星」漂亮地连续击杀对手，又重新掌握比赛节奏，最终以三比一赢得胜利。	6.857142857	5.285714286
台北暗杀星队长陈汇中（mistake）表示：「比赛中虽然一度陷入拉锯，但经过调整，重新找回自己步调，最后能够取得胜利很开心。	7.0	6.571428571
两百三十三万小时，等同两百六十六年，相当于清朝从诞生到灭亡；每天有高达两百二十万的英雄被召唤作战，也有将近四十五万场对战天天上演！	5.0	4.0
《英雄联盟》season2世界冠军赛十月十四日的总冠军赛，台湾战区代表队「台北暗杀星」纔在五战三胜赛制中，以三比一打败对手、韩国「azubufrost」，在全场欢呼声中抱回一百万美元奖金、与象征最高荣耀的召唤师冠军奖杯。	7.888888889	7.125
有韩国网友在官方讨论区发文，怀疑tpa以不正当手段取得胜利，引起韩国玩家讨论。	3.75	4.571428571
因此在他们前进美国争取世界冠军前，很多人并不看好tpa能有亮眼成绩，甚至台湾内部都有很多质疑的杂音。	3.75	4.444444444
8强赛，tpa首先要对抗世界排名第4的韩国代表队najinsword	5.444444444	4.0
nj将顺利击败tpa，没想到tpa硬是闯过这关，杀入4强赛。	6.222222222	5.25
tpa的惊奇之旅将在此止步，但tpa又打破全世界的眼镜，后来居上逆转击败m5。	5.625	4.857142857
azf虽然实力坚强，但并不受人尊敬，本次大赛azf违反运动家精神条款，在比赛时偷瞄转播大屏幕，作弊取得优势，遭主办单位没收20%的奖金。	3.333333333	4.75
除此之外，他们还公开批评其他队伍太弱，除了俄国外没人是韩国对手；而在转播中也收录到，azf的选手用不当言语污辱敌队，做出手指向下等挑衅手势。	3.0	6.5
有韩国网友质疑，tpa能将此战术做到尽乎「完美」的境界，是否有人在台下通风报信？不然实在很难相信tpa每个人都有超强的第6感，可以完全掌握对手的动向，而且每一场比赛几乎都如此。	4.777777778	5.5
战略资源倒数计时，更让人怀疑有人打pass将信息传达给台上比赛的选手。	4.0	5.428571429
世界排名绝对不是随便排排，在3战2胜、5战3胜的赛制中，tpa居然能够一而再、再而三的创造奇迹，打败这些世界排名顶尖的队伍，实在难以置信。	6.714285714	7.0
歌迷昵称「京爷」的张芸京沉潜2年，言谈中兴起了结婚生子的念头，宣布「想婚」，不怕「京爷」形象破灭，歌迷心碎吗？她笑说，「反正我早就想摆脱这个称呼啦！	5.5	3.75
歌迷昵称「京爷」的张芸京沉潜2年推出专辑《小女孩》，一贯中性的打扮，但将头发留长了些，虽还称不上充满女人味，但言谈中感觉她变得比较柔和，甚至兴起了结婚生子的念头，「如果人生到了这个阶段的话，结婚生子是一个备受祝福的事啊！	6.5	5.111111111
消失在乐坛一段时间，张芸京在宣传刚开始时，曾跟工作人员开玩笑说可能要宣布结婚生子才上得了新闻版面。	5.0	4.777777778
玩笑归玩笑，29岁的她对结婚确实有憧憬，「信仰也是一个令我转变的契机吧！	6.5	5.111111111
我在教会看到很多不离不弃的情感，心里面也会希望有一天能够遇到这样的感情。	6.444444444	5.625
如果到了那个年纪，真的想要生小孩，也确定找到一个不错的对象，那就生啊！	5.555555556	4.857142857
而现在的她乐在工作中，会耐心等待理想的另一半出现。	6.666666667	3.666666667
无论是对家人或朋友，张芸京总是习惯报喜不报忧，久而久之也变得不知如何表达，「大家都会看张芸京的外在，好像是很坚强的、感觉是打不倒的。	6.125	4.285714286
成绩进步的奖状，还来不及和家人分享荣耀，就被父母虐打致死。	1.375	5.571428571
师长昨天获悉噩耗都感到讶异与不舍，但副市长蔡炳坤则质疑学校不够积极，以至于悲剧发生。	2.857142857	5.571428571
完整的辅导数据尚未送进市府，可能因此导致蔡副市长有所误解，校方今天将尽速上呈整份资料。	4.875	3.875
校方强调，简姓学童学期末当天，被父母亲失手虐打致死，因现在是放寒假期间，同学目前都还不知情，开学后会进行班级关怀辅导，减轻班上同学对此事件所造成的心理冲击与阴影。	3.285714286	5.142857143
根据信息工业策进会产业情报研究所mic)研究，2011年全球游戏人口超过3亿人，游戏市场规模632亿美元；预估2012年则再增至691亿美元；2013年跳升至732亿美元；2014年达773亿美元；2015年预估值可达821亿美元。	5.625	5.5
鼓励莘莘学子，罗许基金会针对高中（职）以上的单亲、清寒家庭学生提供奖助学金，于1日在罗东博爱医院举办101年度颁奖典礼，让勤奋好学的孩子们能顺利完成学业。	6.625	3.888888889
本次奖助学金在审查过程中看到许多同学生活条件拮据，且大部份来自单亲及隔代教养家庭，甚至有些同学寄人篱下由亲友扶养带大，让审查委员们感到百般不舍。	3.888888889	5.888888889
这次获奖的同学个个都是品学兼优的孩子，就读圣母护专五年级的王位同学，学业成绩始终保持班上第一、二名，他也积极参与医院志工服务，至今已累计近两百小时，除此还参与相关证照考试及研习课程，目前已有急救员及紧急医疗救护技术员之资格。	6.444444444	3.285714286
王位同学来自单亲家庭，由母亲打零工维持家计，王位同学担忧母亲身体健康于是半工半读帮忙负担家计，勇于面对这一切拂逆之状况，也成他独立自主的个性。	5.333333333	4.0
另外就读国立罗东高商数据处理科三年级的潘姿颖同学也是来自单亲家庭，基于教育体制及课程的调整，她无法使用学长姐留给她的教科书，于是她申请奖助学金以减轻教科书的支出，她感谢罗许基金会提供的奖助学金，让她在求学过程获得最实质的帮助。	6.375	4.666666667
现代父母相对于以前传统父母，家庭模式及管教都有很大的转变，以前父母权威非常大，尤其是父亲就像是家中的君王，所有小孩对他又敬又畏，若有犯错，一定来盘「竹笋炒肉丝」处罚，但是后来台湾在经过「爱的教育」与「洋化教育」的影响，这样权威管教及严厉体罚已经慢慢退居主流，取而代之的是要跟小孩做朋友、分担家事，当个新好男人、新好爸爸、新好妈妈。	6.142857143	4.571428571
对此，小儿科黄瑽宁医师表示，这种现象应该只会出现在男孩子身上，女孩子比较少。	5.111111111	4.125
另外，也不要讲出做不到的处罚，与其用「你再不乖就把你丢掉」，还不如实际一点，例如直接警告他说：「你再不听话，等一下就不能看卡通！	4.75	4.777777778
但是若真的把孩子的玩具没收，孩子却哭闹得更凶，这时候就不要理他，要是他再闹，就再没收其他的。	3.888888889	6.333333333
最后，当孩子重复犯错时，要运用「情绪凝结」技巧：也就是转身不理他，让他感受到你是真的生气了。	5.0	5.0
他就会想：「平常爸爸都是开开心心的跟我玩，怎么现在变这样？」他纔会思考自己哪里犯错。	4.428571429	5.666666667
第一次见面，有别于其他会害羞地躲在父母身后的孩子，小红豆主动向我挥手打招呼；而当我和淑文谈话时，她则自在地独处、专注看书。	5.666666667	4.444444444
这对母女间自然流露的温馨互动，似乎让湿冷的天气暖和了起来，心里不禁纳闷，什么样的教养方式，才能培养出如此自主又有礼貌的孩子？你可能对黄淑文的名字不陌生，她也许是你的国中老师、你也可能看过她的书或部落格，或在大学课本上读过她的文章「从浪人到铁人」。	6.375	5.5
现在，她不仅是一位成功的母亲，也是一位懂得做自己的知名作家。	6.4	4.25
作品屡次获得部落客百杰奖，被赋予「最温柔动人的亲子部落格」评价。	7.0	4.625
回想成长过程，不管是生活方式、学校或工作，受到父母期望而下的决定不胜枚举。	4.0	4.555555556
当老师是一个工作稳定的铁饭碗，纵使她大学联考的分数能轻易上台大外文系，自己对社会、心理等科系也比较有兴趣，仍敌不过父母的期盼而填选师大，走上教书的路。	4.555555556	5.285714286
黄淑文说，当她看到榜单出现的是符合父母期望、却是自己不拿手的师大地理系时，心中确实有一股失落感，感觉被囚困在世俗的眼光和父母的期许里。	3.25	4.833333333
有好长一段时间，她恨父亲不让她走想走的路、做想做的事。	2.625	6.0
他爱孩子却不知如何表达自己，更不知如何面对属于父亲的软弱、焦虑和哀伤。	3.0	5.375
她辞去工作专职照顾孩子后，看见孩子身上的特点，竟然有自己童年的影子才发现，当妈妈愈了解自己，才能愈了解孩子，回想小时候希望被对待的方式，其实就是孩子心中渴望的亲子关系。	5.777777778	4.0
7年前她刚开始写作时，常常被退稿，最高纪录连续被退了9次，第9次收到退稿通知时，忍不住哭了起来，她的孩子看到她在哭泣，反过来安慰和鼓励她，她才鼓起勇气投第10次。	5.857142857	5.875
收到稿费后，请孩子吃大餐分享喜悦。	7.111111111	5.571428571
父母和孩子相处时，不用隐藏自己的脆弱和缺点，也不用高高在上地用「大人」的眼光看待孩子，愈能站在孩子的立场理解孩子，愈能拉近和孩子的距离，让孩子敞开心胸和你谈心。	6.555555556	5.222222222
根据调查，国内大学生有将近两成透露，曾遭受交往伴侣暴力对待；国高学生，也有一成有遭亲密伴侣拳脚相向，立委推动修法，要将《家庭暴力防治法》保护范围扩及交往情侣，希望有效减少因情侣争执引起的社会案件。	4.428571429	5.5
台大社工系副教授沈琼桃二○○九年对两千位台湾大学生进行随机抽样问卷，结果显示有交往经验的大学生，曾受肢体暴力者达十八.六％；同样数量的国高中生有一个月以上交往经验的有卅六％，其中三成曾有受暴经验，就是说每十名国高中生，就有一名曾受非同居亲密关系暴力经验。	2.75	5.142857143
台湾防暴联盟执行秘书张琳说，去年三站台中曾发生一起骇人听闻的儿童凶杀案，起因是一名十五岁的国三女学生与廿九岁朱姓网友交往，两人疏远后，朱嫌不断骚扰女方，女学生事前虽曾向警方求助，却无法获适当保护，导致女学生弟弟遭朱嫌杀害。	2.444444444	6.0
民进党立委吴宜臻表示，《家庭暴力防治法》在民国八十七年上路后，经历多次修法，却把保护对象局限在同居关系，或一定亲属关系，导致目前许多交往中的情侣等，虽遭到对方的暴力威胁，却没有法律可以帮忙，她主张修法将未同居亲密关系暴力，纳入保护范围。	4.875	6.0
中共总参谋部日前颁发《二○一三年全军军事训练指示》，要求全军与武警部队加强实战化训练，做好打仗准备，提高打仗能力。	5.5	5.375
历年所罕见，说明军方对周边形势有强烈的忧患意识，调整演训重点，以备不时之需。	6.0	5.0
受此刺激影响，大陆股市昨非但未受波及，军工上市企业反倒应声上扬，一路领涨。	5.0	5.166666667
报导称，该《指示》要求全军和武警部队紧紧围绕能打仗、打胜仗的目标	4.875	5.0
力培养能指挥打仗、保障打仗的优秀人才。	5.888888889	4.0
2012年十大新闻，由你决定谁最大条！	5.111111111	5.142857143
印度尼西亚一名最高法院法官候选人拿强奸受害人开玩笑，受到广泛谴责，可能丢掉法官职务。	3.111111111	6.142857143
印度尼西亚东雅加达一名11岁女童日前疑似遭到师长与同学性侵，经送医后不治身亡，加上接连传出少女遭强奸的案件，引发印度尼西亚民间团体呼吁对强暴犯判处死刑的声浪。	2.625	7.0
高法院法官资格审查听证，议员询问高等法院法官安迪（andiazhar），是否应对强奸犯处以死刑。	5.125	5.428571429
他回答，「强奸犯和遭强奸人都乐在其中，因而需要考虑是否设立死刑」。	3.4	5.285714286
他接受国家电视台记者采访时道歉，说当时只是试图缓和一下紧张气氛。	4.555555556	4.1
苏丁16日告诉法新社记者，「这番粗俗言论不应出自一名法官和最高法院法官)候选人之口」。	3.777777778	5.75
西拉伊特说，法官的职责是保护妇女儿童合法权益。	6.0	4.0
西拉伊特认定，安迪（andiazhar）所言反映印度尼西亚广泛存在的一种观点，即性暴力是正常现象。	3.666666667	4.571428571
反对针对妇女暴力全国委员会统计，1998年至2010年，印度尼西亚发生4845起强奸案。	2.571428571	4.714285714
报导说，印度尼西亚国会司法委员会回应，已经质询安迪（andiazhar），这个月将作出决定，轻则警告，重则解职。	3.571428571	5.75
北韩核试后，环球时报总编辑胡锡进发表微博称：朝鲜走在错误的路上。	4.375	3.875
不过中国长期以来一直支持这个难以预测的盟邦，主要是顾虑到北韩不安的情势可能会造成涌向两国边界的难民潮、美国势力在朝鲜半岛扩展，甚至最终带来两韩统一，这都是中国不愿意见到的事。	4.0	3.888888889
二○○六年，在北韩试射一枚弹道飞弹两个月之后、进行第一次核试前一个月，北京曾悄悄减少对北韩的石油供应，后来的贸易资料才使这件事曝光，北京随后干脆不再公布相关数据。	4.714285714	3.75
纽约时报分析指出，北韩此次核试对习近平构成重大外交挑战，特别是习曾强调他希望美中能建立「新型大国关系」。	5.625	4.75
伊斯兰北非开打组织（aqim）在一九九○年代被阿国军队击败后，撤退到马里、阿尔及利亚、毛里塔尼亚间的撒哈拉无人地带。	4.625	3.777777778
此次阿国人质事件主谋贝尔莫塔就以走私和绑架赚进数百万美元，得以策划天然气田攻击案。	4.0	4.625
有了充足的财源，但武装份子却缺乏取得重型武器的管道。	4.125	4.0
这项限制在二○一一年利比亚爆发反政府革命后改变了，利比亚独裁者格达费的垮台，让他用售油所得买入的大批武器落入各方势力手中，这些武器开始从利比亚边界涌入。	3.777777778	5.333333333
二○一二年，游牧民族图阿雷格族人希望可以在马里北部建立自己的家园，但此目标很快遭到开打与其他极端组织挟持，控制了马里北部。	3.875	4.8
法等国忧aqim攻击欧洲法国和西方盟国担忧aqim会将恐怖主义转移到欧洲。	3.333333333	5.428571429
法国在过去两周来对马里北部的aqim发动惩罚性空袭，aqim是否有时间来策划新一轮恐怖攻击仍是未知数。	4.0	3.625
下一波的攻击目标可能是邻近的毛里塔尼亚、摩洛哥、利比亚或西非国家经济共同体（ecowas）的会员国。	3.428571429	4.571428571
由于美国、英国决定不派兵到马里，法国也希望避免军力部署过度，因此西方各国只能倚赖当地军队，但当地军队并不会全盘接受外界建议。	5.0	4.0
阿尔及利亚的军力没问题，但不积极与美国或其他国家配合。	4.714285714	3.666666667
马里军事力量也弱，任何长期的解决方法都要考虑到国内政治。	4.625	4.333333333
另外，从美国驻利比亚使馆遇袭案的调查结果看来，开打在北非国家的分支与其他武装组织呈现出来的是另一个新面貌的恐怖主义，不见得受到巴基斯坦的开打组织高层控制，但却极端反美。	4.625	5.75
种种因素显示，北非的恐怖组织将会让美国与盟友面临更大的考验。	4.0	4.888888889
中国天主教爱国会的主教指派只听从北京，这些任命案也遭到梵蒂冈抗议与否认。	3.375	5.857142857
梵蒂冈对中国最主要的不满，是境内天主教徒的宗教自由受到压制。	3.0	5.375
教廷频频接获回报，指中国对国内天主教会与机构不但严加管控，甚至针对地下教徒下手，强迫参加「思想改造学习班」。	3.222222222	4.555555556
本笃十六世曾在五年多前对中国天主教徒发出牧函，要求统一中国控制的教会和地下教会，结果情况变得更糟	3.75	4.444444444
福祷后，呼吁叙利亚结束暴力、以巴早日谈判，以及中国新领导人尊重宗教贡献、尊重个人，并协助建立一个友爱的社会。	6.777777778	5.0
中油扩张解释规定，还说中油只是申报填写时「偷懒」没写清楚，所以审核时依「事实认定」，照给最高上限的绩效奖金。	3.888888889	5.333333333
国营事业亏损连连，却仍发放高额绩效奖金，引发外界强烈批评。	3.75	4.142857143
回应社会改革声浪，立法院长王金平昨天邀集朝野党团协商后，达成共识，要求中油、台电、台糖和自来水公司等四家国营事业，今年度发放经营绩效奖金，最高不得超过一.二个月，将较现行二.六个月，大砍一半以上，初估平均每位员工将少领约十万元奖金。	4.857142857	4.428571429
此外，朝野立委也达成共识，自明年度起，所有国营事业，包括油电糖水、公股银行等，必须要有盈余，才能发放绩效奖金，但最高也不得超过一.二个月，若亏损则「一毛钱都不能发」。	4.777777778	5.0
根据朝野协商的结论，油电糖水等四家国营事业一百年度经营绩效奖金，发放不得超过一.二个月；自一○一年度开始，国营事业有盈余者，始得发放绩效奖金，但不得超过一.二个月。	5.125	4.125
台联立委许忠信会后受访表示，绩效奖金大砍一.四个月后，以国营事业员工平均薪资约七万元计算，每位员工将少领约十万元年终奖金，立法院已适度展现改革诚意。	4.666666667	4.875
反映国家经济困境、回应社会民意和改革声浪，必须要做出的决定。	5.375	4.375
未来若经济复苏，朝野每年协商总预算时，还是可进行调整，届时绩效奖金说不定可以恢复到二.六个月，甚至更多。	5.888888889	5.0
国营事业员工绩效奖金，确定维持一.二个月上限，今年之内无法翻盘。	4.2	4.777777778
立法院昨天休会前通过朝野协商结论，国营事业绩效奖金确定维持上周方案，一百年度国营事业绩效奖金不得超过一.二个月，一○一年起则须有盈余才能发放，最高额度也不得超过一.二个月。	5.0	3.375
回应民意，上周一在一○二年度中央政府总预算协商时达成协议，油电糖水等四家国营事业一百年度经营绩效奖金，不得超过一.二个月；一○一年度起，国营事业有盈余者，始得发放绩效奖金，但金额也不得超过一.二个月。	5.111111111	4.25
上周协商时，朝野党团虽达成删减绩效奖金共识，但具体立场仍南辕北辙。	4.222222222	4.0
然而因国营事业员工对绩效奖金缩水反弹强烈，立法院上周也通过亲民党团要求政院将绩效奖金发放核算法制化，未来只要政院提出核算办法，国营事业绩效奖金就不需遵从立院决议的一.二个月上限，引来「绩效奖金败部复活」疑虑。	4.125	5.222222222
绩效奖金召开临时会，但要求删除「不再行处理」字样，其余皆依上周结论办理。	4.888888889	4.285714286
当然，政府的责任最大，务必有效思考对策：一、救火救急，息怒第一：搧风点火不是人民之福，熄火重建纔是全民所盼！	6.0	5.888888889
最关切的议题，不外乎是景气与就业，也就是对饭碗与生活的忧虑，与此密不可分的正是物价之波动。	5.5	3.714285714
每次单一批判的论调起舞，陷入了「无解又无感」的困境。	4.142857143	3.857142857
要求政府把事情做对（justdoitright），不算过分，应该也没有那么难！	4.625	6.1
就在钓鱼台争端正处于僵持之际，美国派遣航母进入钓鱼台附近海域。	4.666666667	3.625
强硬反应，中国军方不仅随后举行大型军演，还在近日派遣7艘军舰穿过冲绳海域驶向太平洋。	4.125	5.5
美中在钓鱼台争端中的对抗逐步升级，钓鱼台局势再现紧张态势。	3.25	5.777777778
香港中评社发表专论指出，在钓鱼台争端初期，美国只是一再宣称钓鱼台适用于《美日安保条约》，希望以此来威慑中国，逼迫中国在争端中让步。	4.5	4.777777778
但是中国并没有被美国的几句声明所吓倒，反而果断的采取取了强硬反制措施，这使得美国开始逐步考虑透过加强军事部署的手段来震慑中国。	4.125	4.375
就在美国国防部长帕内达访问中国时，美国高调宣布加强在日本的军事部署力度，就是试图给中国施加压力，遏制中国的强硬反应。	5.7	4.833333333
在这种情况下，美国又采取软硬兼施的两手策略，一方面，美国宣称美国在中日钓鱼台争端中不选边站，不充当钓鱼台争端的调停人，希望中日以和平手段解决钓鱼台问题。	4.875	5.142857143
另一方面，美国又不断加强在钓鱼台附近海域的军事部署力度，试图以军事手段压制中国，逼迫中国不再采取强硬反制措施。	4.111111111	5.75
因此，在中国不断派遣海监船进入钓鱼台毗邻区和周边12海里海域，而日本却无法应对之后，美国决定通过派遣航母进入钓鱼台附近海域以及加强与菲律宾在南海的军事合作等军事部署强化措施来警告中国勿采取强硬反制措施。	4.6	4.285714286
然而，美国软硬兼施的策略让中国更加清醒的认识到了美国在钓鱼台争端中的真实目的，对美国也愈发不信任。	4.25	5.285714286
本次军演是针对美国航母进入西海而实施，是与投入这一带海域的美国航母编队较劲。	5.777777778	5.333333333
中评社指出，中国的这些反制动作再次表明，美国的武力威慑措施并不凑效，不管美国采取何种武力威慑措施，中国都不会惧怕，中国会坚决维护领土完整。	6.333333333	6.777777778
美国人也并非没有意识到中国保卫领土完整的决心，事实上，此次美国航母进入钓鱼台附近海域除了震慑中国外	4.777777778	5.666666667
美国的这些举动是对中国的挑衅，因此，中国也加大军事部署来以硬踫硬，这纔是真正值得担忧的地方。	3.125	6.111111111
林飞帆讲得很有道理死刑不能抑止犯罪大家要给他鼓励所以我们应该公开满清十大酷刑处理这种人外加现场直播他想自杀，又不敢自杀所以想多杀人，让法院判他死刑但法院给他的死刑完全符合他的期望一枪毙命搞不好没痛苦就离开人间要抑止这种犯罪就是让这种人害怕就是要让人不去干扰他人生活为主	3.428571429	6.428571429
今（18）日是「国际移工日」，多个移工团体组成的「台湾移工联盟（ment）」早上前往行政院陈情，反对政府将外劳工资脱钩、增加外劳配额等政策规划，并要求政府落实人权公约，对刘姗姗这类剥削外劳的雇主定罪。	4.75	6.0
由台湾国际劳工协会（tiwa）、天主教越南外劳配偶办公室等移工团体组成的ment今天上午前往行政院，他们指出，2012年12月21日是马雅传说中的世界末日，但世界末日还没到，在台湾的移工早就过得有如世界末日般的日子。	3.0	5.714285714
近50名外劳与移工团体代表高喊「反工资脱钩，要同工同酬」、「反血汗长照，要家服立法」，要求政府正视移工面临的问题。	2.875	6.0
不少移工今天也到场喊出心声，他们在现场演出行动剧，演员表演马总统与大老板同流合污，不断引进便宜外劳，外劳双脚下跪双手撑地，迭起「人肉金字塔」，而大老板则缓缓爬上金字塔顶端，马总统则用打气筒不断替老板打气，撑到大老板肚子都破了，讽刺政府不公平的外劳政策。	3.0	4.5
tiwa专员许家隽指出，台湾今年1整年有许多歧视外劳的事件，包括行政院增加外劳引进配额，制造更多便宜但血汗的奴工；解决外籍看护工休假问题的《家事服务法》，遭到行政院冷冻多时；台北车站9月间在大厅拉起「红龙」，阻止外劳聚集。	3.777777778	6.0
天主教新竹移民及外劳服务中心主任、澳洲籍神父吴嘉德表示，今天是「国际移工日」，但台湾的移工权益却屡遭忽略。	3.333333333	5.25
在美国已触犯人口贩运法令，但刘姗姗在台湾却被判无罪，而台湾的《人口贩运防治法》公布至今，由于认定条件严格因此没有1位法官引用该法定罪，更让台湾的人口贩运防治政策沉沦	3.8	4.857142857
